{
  "version": "0.5.0",
  "lastUpdated": "2026-05-13",
  "sources": [
    {
      "id": "fowler_refactoring",
      "title": "Refactoring: Improving the Design of Existing Code (2nd ed.)",
      "author": "Martin Fowler",
      "year": 2018,
      "url": "https://martinfowler.com/books/refactoring.html"
    },
    {
      "id": "fowler_bliki_smells",
      "title": "CodeSmell (bliki)",
      "author": "Martin Fowler",
      "url": "https://martinfowler.com/bliki/CodeSmell.html"
    },
    {
      "id": "refactoring_guru",
      "title": "Refactoring.Guru — Code Smells",
      "url": "https://refactoring.guru/refactoring/smells"
    },
    {
      "id": "sourcemaking_smells",
      "title": "SourceMaking — Code Smells",
      "url": "https://sourcemaking.com/refactoring/smells"
    },
    {
      "id": "sourcemaking_antipatterns",
      "title": "SourceMaking — AntiPatterns",
      "url": "https://sourcemaking.com/antipatterns"
    },
    {
      "id": "detekt_rules",
      "title": "Detekt — Documentation",
      "url": "https://detekt.dev/docs/intro"
    },
    {
      "id": "smells_catalog",
      "title": "Code Smells Catalog (Marcel Jerzyk)",
      "url": "https://luzkan.github.io/smells/"
    },
    {
      "id": "wake_refactoring_workbook",
      "title": "Refactoring Workbook",
      "author": "William C. Wake",
      "year": 2003,
      "url": "https://www.oreilly.com/library/view/refactoring-workbook/0321109295/"
    },
    {
      "id": "foote_yoder_big_ball_of_mud",
      "title": "Big Ball of Mud",
      "author": "Brian Foote and Joseph Yoder",
      "year": 1997,
      "url": "http://www.laputan.org/mud/"
    },
    {
      "id": "brooks_no_silver_bullet",
      "title": "No Silver Bullet — Essence and Accident in Software Engineering",
      "author": "Frederick P. Brooks, Jr.",
      "year": 1986,
      "url": "https://en.wikipedia.org/wiki/No_Silver_Bullet"
    },
    {
      "id": "knuth_structured_programming_with_goto",
      "title": "Structured Programming with go to Statements (Computing Surveys)",
      "author": "Donald E. Knuth",
      "year": 1974,
      "url": "https://dl.acm.org/doi/10.1145/356635.356640"
    },
    {
      "id": "mikhajlov_sekerinski_fbc",
      "title": "A Study of The Fragile Base Class Problem (ECOOP)",
      "author": "Leonid Mikhajlov and Emil Sekerinski",
      "year": 1998,
      "url": "https://link.springer.com/chapter/10.1007/BFb0054099"
    },
    {
      "id": "evans_ddd",
      "title": "Domain-Driven Design: Tackling Complexity in the Heart of Software",
      "author": "Eric Evans",
      "year": 2003,
      "url": "https://www.informit.com/store/domain-driven-design-tackling-complexity-in-the-heart-9780321125217"
    },
    {
      "id": "feathers_legacy",
      "title": "Working Effectively with Legacy Code",
      "author": "Michael C. Feathers",
      "year": 2004,
      "url": "https://www.informit.com/store/working-effectively-with-legacy-code-9780131177055"
    },
    {
      "id": "fowler_poeaa",
      "title": "Patterns of Enterprise Application Architecture",
      "author": "Martin Fowler",
      "year": 2002,
      "url": "https://martinfowler.com/books/eaa.html"
    },
    {
      "id": "karwin_sql_antipatterns",
      "title": "SQL Antipatterns: Avoiding the Pitfalls of Database Programming",
      "author": "Bill Karwin",
      "year": 2010,
      "url": "https://pragprog.com/titles/bksqla/sql-antipatterns/"
    },
    {
      "id": "ogden_callback_hell",
      "title": "Callback Hell — A guide to writing asynchronous JavaScript",
      "author": "Max Ogden",
      "url": "http://callbackhell.com/"
    },
    {
      "id": "owasp_sql_injection",
      "title": "OWASP — SQL Injection",
      "url": "https://owasp.org/www-community/attacks/SQL_Injection"
    }
  ],
  "entries": [
    {
      "id": "long_method",
      "name": "Long Method",
      "family": "Bloaters",
      "description": "A method that has accreted multiple responsibilities and exceeds the size where a reader can hold its intent in one pass.",
      "llm_detection_signals": [
        "method body > 30 lines excluding comments and blank lines",
        "internal block comments dividing the body into 'sections'",
        "multiple distinct return value computations interleaved",
        "deep nesting (>= 3 levels) within one method"
      ],
      "language_notes": {
        "Kotlin": "Long bodies inside scope functions (let/run/apply/with) count — flag the enclosing function, not the lambda alone.",
        "Java": "Static utility methods are often the worst offenders; inspect `public static` first.",
        "Scala": "Long `for`-comprehensions and chained `map`/`flatMap` pipelines hide method length — count the AST, not the line count.",
        "JavaScript": "Long arrow-function bodies and immediately-invoked function expressions count. Watch for handlers in framework code (`useEffect`, route handlers) that grew over time.",
        "Apex": "Trigger handler methods routinely become long. Push behavior into service classes and keep handlers as routing.",
        "Swift": "View-controller methods accumulate over a screen's lifecycle; `viewDidLoad` is the classical offender.",
        "PLSQL": "Stored procedures that mix validation, transformation, and side-effects are the typical instance. Split into purpose-named procedures and call them in sequence.",
        "*": "Constructor bodies > 15 lines are a separate, stronger signal."
      },
      "refactoring": "Extract Method; Replace Method with Method Object when extracted methods share many parameters; Decompose Conditional when the bulk is branching logic.",
      "pmd_overlap": ["ExcessiveMethodLength", "CyclomaticComplexity", "NcssCount"],
      "seeded_from": ["fowler_refactoring", "refactoring_guru"],
      "canonical_references": [
        {
          "type": "book",
          "title": "Refactoring: Improving the Design of Existing Code, 2nd ed.",
          "author": "Martin Fowler",
          "section": "ch. 3 \"Bad Smells in Code\" — Long Function",
          "year": 2018,
          "url": "https://martinfowler.com/books/refactoring.html"
        },
        {
          "type": "web",
          "title": "Long Method (refactoring.guru)",
          "url": "https://refactoring.guru/smells/long-method"
        }
      ]
    },
    {
      "id": "large_class",
      "name": "Large Class",
      "family": "Bloaters",
      "description": "A class that has taken on too many responsibilities — too many fields, too many methods, or too many distinct collaborators — and resists understanding as a single concept.",
      "llm_detection_signals": [
        "class declares > 15 instance fields",
        "class declares > 20 public methods",
        "field names cluster into two or more disjoint conceptual groups",
        "comments inside the class header announce multiple 'responsibilities'"
      ],
      "language_notes": {
        "Kotlin": "Data classes with > 7 properties are often a Data Clump in disguise; inspect for a missing value object.",
        "Java": "Manager / Service / Helper suffixes on a >500-line class are a strong signal.",
        "Scala": "Traits that mix in many concerns produce the same shape; Cake-pattern abuse is the obvious case.",
        "JavaScript": "ES6 classes accumulate methods over a feature lifecycle; React class components that survived a hooks migration often qualify.",
        "Apex": "Salesforce controllers and trigger handlers grow without bound. The Trigger Handler pattern (Kevin O'Hara) is the standard cure.",
        "Swift": "UIKit view controllers are the canonical offender; MVVM and Coordinator patterns extract responsibilities.",
        "PLSQL": "Packages that group all data access for a large schema usually want to split along subject area."
      },
      "refactoring": "Extract Class along the field clusters; Extract Subclass when one cluster is a specialization; Extract Interface when callers use disjoint method subsets.",
      "pmd_overlap": ["GodClass", "ExcessivePublicCount", "TooManyFields", "TooManyMethods"],
      "seeded_from": ["fowler_refactoring", "refactoring_guru"],
      "canonical_references": [
        {
          "type": "book",
          "title": "Refactoring: Improving the Design of Existing Code, 2nd ed.",
          "author": "Martin Fowler",
          "section": "ch. 3 — Large Class",
          "year": 2018,
          "url": "https://martinfowler.com/books/refactoring.html"
        },
        {
          "type": "web",
          "title": "Large Class (refactoring.guru)",
          "url": "https://refactoring.guru/smells/large-class"
        }
      ]
    },
    {
      "id": "primitive_obsession",
      "name": "Primitive Obsession",
      "family": "Bloaters",
      "description": "Using primitive types (strings, ints, maps) to model concepts that deserve their own type — so validation, formatting, and invariants get scattered across the codebase.",
      "llm_detection_signals": [
        "repeated string parameters with names like 'email', 'phone', 'currency'",
        "validation regex repeated in multiple call sites for the same logical value",
        "`Map<String, Object>` or generic dict used as a poor man's struct",
        "pairs of primitives passed together everywhere (e.g., amount + currency code)"
      ],
      "language_notes": {
        "Kotlin": "Prefer `value class` (inline class) for type-safe wrappers over primitives — near-zero runtime cost.",
        "Java": "Records (Java 16+) make value-object extraction cheap; flag candidates.",
        "Scala": "AnyVal value classes give zero-runtime-cost wrappers; opaque types (Scala 3) are even cleaner.",
        "Swift": "Use `struct` with `RawRepresentable` or a dedicated wrapper struct; `typealias` alone is not enough — it still permits assignment between primitives.",